{
  "suite_name": "osek-local",
  "description": "Local OSEK event, priority, and event regression cases already present in check-src.",
  "enabled": true,
  "runs": 1,
  "warmups": 0,
  "variants": ["stock_cprover_async", "improved_pipeline"],
  "cases": [
    {
      "name": "osek-event-interleaving",
      "enabled": true,
      "root": "check-src/simple-benchmarks/osek_event_interleaving",
      "sources": ["harness.c", "task_define/tasks.c", "isr_define/isr.c", "osek/osek_runtime_stub.c"],
      "include_dirs": [".", "task_define", "isr_define", "osek"],
      "isr_sources": ["isr_define/isr.c"],
      "isr_functions": ["isr_touch_shared"],
      "entry_function": "main",
      "properties": [],
      "unwind": 8,
      "defines": [],
      "cbmc_args": ["--unwinding-assertions"],
      "variant_cbmc_args": {
        "stock_cprover_async": ["--os-api", "osek", "--osek-oil", "app.oil"],
        "improved_pipeline": ["--os-api", "osek", "--osek-oil", "app.oil"]
      },
      "expected_result": "same-result",
      "timeout_sec": 180,
      "memory_limit_mb": 4096
    },
    {
      "name": "osek-priority-interleaving",
      "enabled": true,
      "root": "check-src/simple-benchmarks/osek_priority_interleaving",
      "sources": ["harness.c", "task_define/tasks.c", "isr_define/isr.c", "osek/osek_runtime_stub.c"],
      "include_dirs": [".", "task_define", "isr_define", "osek"],
      "isr_sources": ["isr_define/isr.c"],
      "isr_functions": ["isr_boost_shared"],
      "entry_function": "main",
      "properties": [],
      "unwind": 6,
      "defines": [],
      "cbmc_args": ["--unwinding-assertions"],
      "variant_cbmc_args": {
        "stock_cprover_async": ["--os-api", "osek", "--osek-oil", "app.oil"],
        "improved_pipeline": ["--os-api", "osek", "--osek-oil", "app.oil"]
      },
      "expected_result": "same-result",
      "timeout_sec": 180,
      "memory_limit_mb": 4096
    },
    {
      "name": "osek-event-basic",
      "enabled": false,
      "reason": "Regression case has no dedicated ISR source yet; tracked for future harness normalization.",
      "root": "check-src/simple-benchmarks/osek_event_regression/osek-event-basic",
      "sources": ["main.c"],
      "include_dirs": ["."],
      "isr_sources": ["main.c"],
      "isr_functions": ["isr_placeholder"],
      "entry_function": "main",
      "properties": [],
      "unwind": 3,
      "defines": [],
      "expected_result": "same-result",
      "timeout_sec": 120,
      "memory_limit_mb": 2048
    },
    {
      "name": "osek-event-multi-bits",
      "enabled": false,
      "reason": "Regression case has no dedicated ISR source yet; tracked for future harness normalization.",
      "root": "check-src/simple-benchmarks/osek_event_regression/osek-event-multi-bits",
      "sources": ["main.c"],
      "include_dirs": ["."],
      "isr_sources": ["main.c"],
      "isr_functions": ["isr_placeholder"],
      "entry_function": "main",
      "properties": [],
      "unwind": 3,
      "defines": [],
      "expected_result": "same-result",
      "timeout_sec": 120,
      "memory_limit_mb": 2048
    },
    {
      "name": "osek-event-wait-block",
      "enabled": false,
      "reason": "Regression case has no dedicated ISR source yet; tracked for future harness normalization.",
      "root": "check-src/simple-benchmarks/osek_event_regression/osek-event-wait-block",
      "sources": ["main.c"],
      "include_dirs": ["."],
      "isr_sources": ["main.c"],
      "isr_functions": ["isr_placeholder"],
      "entry_function": "main",
      "properties": [],
      "unwind": 3,
      "defines": [],
      "expected_result": "same-result",
      "timeout_sec": 120,
      "memory_limit_mb": 2048
    },
    {
      "name": "osek-event-wait-noblock",
      "enabled": false,
      "reason": "Regression case has no dedicated ISR source yet; tracked for future harness normalization.",
      "root": "check-src/simple-benchmarks/osek_event_regression/osek-event-wait-noblock",
      "sources": ["main.c"],
      "include_dirs": ["."],
      "isr_sources": ["main.c"],
      "isr_functions": ["isr_placeholder"],
      "entry_function": "main",
      "properties": [],
      "unwind": 3,
      "defines": [],
      "expected_result": "same-result",
      "timeout_sec": 120,
      "memory_limit_mb": 2048
    }
  ]
}
