{
  "suite_name": "trampoline-c-async",
  "description": "Historical check-src Trampoline CPROVER async comparison tree.",
  "enabled": true,
  "runs": 1,
  "warmups": 0,
  "variants": ["stock_naive", "improved_targeted"],
  "cases": [
    {
      "name": "trampoline-c-async-alarms-s1-non",
      "enabled": true,
      "root": "check-src/simple-benchmarks/trampoline_c_async",
      "sources": [
        "tests/embUnit/AssertImpl.c",
        "tests/embUnit/RepeatedTest.c",
        "tests/embUnit/SchedulingCheck.c",
        "tests/embUnit/stdImpl.c",
        "tests/embUnit/TestCaller.c",
        "tests/embUnit/TestCase.c",
        "tests/embUnit/TestResult.c",
        "tests/embUnit/TestRunner.c",
        "tests/embUnit/TestSuite.c",
        "tests/functional/alarms_s1_non/alarms_s1.c",
        "tests/functional/alarms_s1_non/task1_instance.c",
        "tests/functional/alarms_s1_non/isr_define/isr.c",
        "tests/functional/alarms_s1_non/alarms_s1_non/tpl_app_config.c",
        "tests/functional/alarms_s1_non/alarms_s1_non/tpl_os.c",
        "os/tpl_os_kernel.c",
        "os/tpl_os_timeobj_kernel.c",
        "os/tpl_os_action.c",
        "os/tpl_os_error.c",
        "os/tpl_os_os_kernel.c",
        "os/tpl_os_os.c",
        "os/tpl_os_interrupt_kernel.c",
        "os/tpl_os_task_kernel.c",
        "os/tpl_os_resource_kernel.c",
        "os/tpl_os_alarm_kernel.c",
        "machines/posix/tpl_machine_posix.c",
        "machines/posix/tpl_viper_interface.c",
        "machines/posix/tpl_posix_autosar.c",
        "machines/posix/tpl_posix_irq.c",
        "machines/posix/tpl_posix_context.c",
        "machines/posix/tpl_posixvp_irq_gen.c",
        "tests/machines/posix/archTestConfig.c",
        "tests/machines/common/commonTestConfig.c"
      ],
      "include_dirs": [
        "machines/posix",
        "viper",
        "tests/embUnit",
        "tests/machines/common",
        "tests/machines/posix",
        "com",
        "os",
        "debug",
        "tests/functional/alarms_s1_non/alarms_s1_non"
      ],
      "isr_sources": ["tests/functional/alarms_s1_non/isr_define/isr.c"],
      "isr_functions": ["isr1", "isr2", "isr3"],
      "entry_function": "main",
      "properties": ["main.assertion.1", "main.assertion.2", "main.assertion.3"],
      "unwind": 3,
      "defines": [],
      "expected_result": "same-result",
      "timeout_sec": 900,
      "memory_limit_mb": 16384
    }
  ]
}
